Role,Message
user,give me info about cancer
assistant,"Based on the provided context, I can give you some information about cancer.

Cancer is an abnormal growth of cells that can occur in any part of the body. It's characterized by uncontrolled cell division and growth, which can lead to tumors or lumps. Cancer can be benign (non-cancerous) or malignant (cancerous).

Some key points about cancer include:

* How quickly it may grow: The rate at which cancer grows varies depending on the type of cancer and individual factors.
* Likelihood of spreading: Cancer cells can break away from the primary tumor and spread to other parts of the body through the bloodstream or lymphatic system. This is known as metastasis.
* Treatment effectiveness: The success of treatments, such as surgery, chemotherapy, radiation therapy, or a combination of these, depends on various factors, including the type of cancer, its stage, and individual characteristics.

If you have specific questions about cancer or would like more information, feel free to ask!"
user,hi
assistant,Hi! I'm here to help with any medical concerns or questions you may have. What's on your mind? Do you have a specific question or topic in mind that you'd like to discuss?
user,give me info about cancer
assistant,"Based on the provided context, I can give you some information about cancer.

Cancer is an abnormal growth of cells that can occur in any part of the body. It's characterized by uncontrolled cell division and growth, which can lead to tumors or lumps. Cancer can be benign (non-cancerous) or malignant (cancerous).

Some key points about cancer include:

* How quickly it may grow: The rate at which cancer grows varies depending on the type of cancer and individual factors.
* Likelihood of spreading: Cancer cells can break away from the primary tumor and spread to other parts of the body through the bloodstream or lymphatic system. This is known as metastasis.
* Treatment effectiveness: The success of treatments, such as surgery, chemotherapy, radiation therapy, or a combination of these, depends on various factors, including the type of cancer, its stage, and individual characteristics.

If you have specific questions about cancer or would like more information, feel free to ask!"
user,give me info about cancer
assistant,"Based on the provided context, I can give you some information about cancer.

Cancer is an abnormal growth of cells that can occur in any part of the body. It's characterized by uncontrolled cell division and growth, which can lead to tumors or lumps. Cancer can be benign (non-cancerous) or malignant (cancerous).

Some key points about cancer include:

* How quickly it may grow: The rate at which cancer grows varies depending on the type of cancer and individual factors.
* Likelihood of spreading: Cancer cells can break away from the primary tumor and spread to other parts of the body through the bloodstream or lymphatic system. This is known as metastasis.
* Treatment effectiveness: The success of treatments, such as surgery, chemotherapy, radiation therapy, or a combination of these, depends on various factors, including the type of cancer, its stage, and individual characteristics.

If you have specific questions about cancer or would like more information, feel free to ask!"
user,give me info about cancer
assistant,"question: What is (are) Cancer ?

Answer: Tumors are abnormal growths in your body. They are made up of extra cells. Normally, cells grow and divide to form new cells as your body needs them. When cells grow old, they die, and new"
user,give me info about lunge cancer
assistant,"Based on the provided context, I can give you information about lung cancer.

Lung cancer is a type of cancer that affects the lungs. It occurs when abnormal cells in the lungs grow and multiply uncontrollably, forming tumors. There are two main types of lung cancer: non-small cell lung cancer (NSCLC) and small cell lung cancer (SCLC).

Symptoms of lung cancer may include:

* Coughing up blood or rust-colored mucus
* Chest pain or discomfort
* Shortness of breath or wheezing
* Fatigue or weakness
* Loss of appetite
* Unexplained weight loss

Risk factors for developing lung cancer include:

* Smoking: The most significant risk factor is smoking, as it damages the lungs and increases the risk of developing lung cancer.
* Secondhand smoke exposure
* Radon exposure
* Asbestos exposure
* Family history of lung cancer
* Exposure to certain chemicals or substances at work

Treatment options for lung cancer depend on the stage and type of cancer. Common treatments include:

* Surgery: Removing the tumor and surrounding tissue
* Chemotherapy: Using medications to kill cancer cells
* Radiation therapy: Using high-energy radiation to kill cancer cells
* Targeted therapy: Using medications that target specific genes or proteins involved in cancer growth

Early detection and treatment can improve survival rates for lung cancer patients. If you have concerns about your risk factors or symptoms, it's essential to consult with a healthcare professional.

Would you like me to elaborate on any specific aspect of lung cancer?"
user,give me info about cancer
assistant,"Sure! Here's some information about cancer:

1. Cancer is a group of diseases that affect the body's cells, usually in the form of abnormal growths or tumors.

2. The most common types of cancer are breast cancer, prostate cancer, lung cancer, colon cancer, and leukemia.

3. Cancer can occur at any age, but it is more common in older adults due to lifestyle factors such as smoking, alcohol consumption, and obesity.

4. The cause of cancer is not fully understood, but researchers believe that it may be linked to environmental exposures, genetic mutations, and immune system dysfunction.

5. Cancer can be diagnosed through a variety of methods, including blood tests, imaging scans, biopsies, and surgery.

6. Treatment for cancer depends on the type and stage of the disease, as well as the patient's overall health and medical history.

7. Cancer treatment can involve chemotherapy, radiation therapy, hormone therapy, immunotherapy, and targeted therapy.

8. Cancer survivors may face long-term side effects from their treatments, such as nausea, fatigue, and skin irritation.

9. Early detection and prevention of cancer through regular checkups and screenings can help reduce the risk of developing cancer in the first place."
user,what is the capital of the france
assistant,"The capital of the French region of Franche-Comté is Coëvres. It is located in the eastern part of the region and is the administrative center of the canton of Coëvres. The canton has a population of around 10,000 people and is surrounded by the neighboring cantons of Belfort (to the north), Bas-Rhin (to the east), and Jura (to the south)."
user,who is the president
assistant,"The current President of France is Emmanuel Macron. He was elected in May 2017, after winning the first round of voting with 65% of the vote. Macron is a member of the Socialist Party and has been a prominent figure in French politics for several years. Prior to his election as president, he served as Prime Minister from 2014 to 2017."
user,how about lunge cancer
assistant,"Lunge cancer is a type of lung cancer that affects the cells lining the air sacs (alveoli) in the lungs. It is one of the most common types of lung cancer, with an estimated 10% to 20% of all lung cancers diagnosed each year. Lunge cancer is often caused by exposure to secondhand smoke or other environmental factors such as air pollution. The disease is characterized by a growth of abnormal cells in the lungs, which can lead to difficulty breathing, coughing, and shortness of breath. Early detection and treatment are crucial for improving outcomes for lunge cancer patients."
user,give me some info about the cancer
assistant,"Based on the provided context, here's what I can tell you about cancer:

Cancer refers to a group of diseases characterized by the uncontrolled growth and spread of abnormal cells. The abnormal cells may form a tumor, which is a mass of cancerous cells that can invade nearby tissues and organs.

Some types of tumors may recur, meaning they come back after treatment. Cancer can occur anywhere in the body, and its symptoms depend on where it forms. For example, if cancer occurs in the skin, you might notice changes such as a new mole or a change in an existing one. If cancer occurs elsewhere in the body, you might experience symptoms like pain, fatigue, weight loss, or difficulty swallowing.

When diagnosing cancer, doctors consider factors such as:

* The type of cancer
* The size of the tumor and what part of the body it affects
* The patient's general health

Keep in mind that this is a general overview, and if you have specific concerns or questions about cancer, I recommend consulting with a medical professional for personalized advice."
user,who is the president of the usa
assistant,"I'm happy to help! However, my knowledge cutoff is based on the provided context, which doesn't contain any information about the current President of the USA.

To provide you with accurate and up-to-date information, I recommend checking a reliable news source or official government website for the latest information on the current President of the United States."
user,give me some info about the cancer
assistant,"According to the documents, here's what's known about cancer:

*   It involves symptoms and where the cancer forms in the body.
*   Some kinds of tumors may recur.
*   The type of cancer is a factor.
*   The size of the tumor and what part of the body it affects is important.
*   The patient's general condition is also considered."
user,hey
assistant,Hello! I'm here to help with any medical concerns or questions you may have. What's on your mind?
